{"schema_version": 1, "kind": "normalized-review", "target_sha256": "aaaaaaaaaaaaaaaaaaaaaaaaaaaaaaaaaaaaaaaaaaaaaaaaaaaaaaaaaaaaaaaa", "findings": [{"id": "f1", "severity": "critical", "category": "command-injection", "file": "src/run.ts", "line": 12, "title": "Shell command built from user input", "rationale": "The task string reaches exec() unescaped."}], "summary": "One critical finding.", "verdict": "request-changes"}
